{
  "schemaVersion": "1.0.0",
  "projectId": "PRJ-REAL-APT-0001",
  "researchId": "PRICE-RESEARCH-PRJ-REAL-APT-0001-BATHROOM-FIXTURES-001",
  "researchName": "PRJ-REAL-APT-0001 욕실 도기류/욕실장/샤워부스 단가 조사",
  "status": "NEEDS_RESEARCH",
  "brandCandidates": ["대림바스", "이누스", "계림", "아메리칸스탠다드", "TOTO", "Grohe", "Hansgrohe", "한샘"],
  "approvalPolicy": {
    "masterDbDirectUpdateAllowed": false,
    "approvalRequiredBeforeMasterDbUpdate": true,
    "approvalRequestType": "MasterDbUpdateRequest",
    "rollbackRequired": true,
    "approvedBy": "CEO"
  },
  "items": [
    {
      "projectId": "PRJ-REAL-APT-0001",
      "itemId": "BATH-FIX-TOILET-001",
      "itemName": "양변기",
      "category": "BathroomFixture",
      "subcategory": "toilet",
      "brandName": "NEEDS_RESEARCH",
      "brandCandidates": ["대림바스", "이누스", "계림", "아메리칸스탠다드", "TOTO"],
      "modelName": "NEEDS_RESEARCH",
      "standardSpec": "투피스/원피스/치마형 여부 조사",
      "unit": "ea",
      "quantityBasis": "욕실 수량 기준",
      "officialPrice": "NEEDS_RESEARCH",
      "marketPrice": "NEEDS_RESEARCH",
      "dealerPrice": "NEEDS_RESEARCH",
      "supplierPrice": "NEEDS_RESEARCH",
      "internalPrice": "NEEDS_RESEARCH",
      "laborCost": "NEEDS_RESEARCH",
      "accessoryCost": "NEEDS_RESEARCH",
      "installationDifficulty": "UNKNOWN",
      "warrantyPeriod": "NEEDS_RESEARCH",
      "asPolicy": "NEEDS_RESEARCH",
      "commonDefectRisk": ["누수", "흔들림", "배수 불량", "부속품 불량"],
      "minimumOrderUnit": "NEEDS_RESEARCH",
      "leadTimeDays": "NEEDS_RESEARCH",
      "paymentCondition": "NEEDS_RESEARCH",
      "preferredSupplier": "NEEDS_RESEARCH",
      "alternativeItems": ["비데 일체형 양변기", "원피스 양변기", "투피스 양변기"],
      "sourceCandidates": [
        {"sourceType": "dealer", "sourceName": "대림바스/이누스/계림 대리점", "dataToCollect": ["dealerPrice", "supplierPrice", "leadTimeDays", "warrantyPeriod", "asPolicy"]},
        {"sourceType": "market", "sourceName": "온라인 욕실 자재몰", "dataToCollect": ["marketPrice", "modelName", "deliveryFee"]},
        {"sourceType": "internal", "sourceName": "ECOREAN 실제 구매/하자 기록", "dataToCollect": ["internalPrice", "actualDefectRate", "installerPreference"]}
      ],
      "sourceType": "NEEDS_RESEARCH",
      "sourceName": "NEEDS_RESEARCH",
      "sourceDate": "NEEDS_RESEARCH",
      "confidenceLevel": "UNKNOWN",
      "updateCycle": "monthly_until_verified",
      "approvalStatus": "NEEDS_RESEARCH",
      "approvalFlow": {"nextStep": "CREATE_MASTER_DB_UPDATE_REQUEST", "approvalRequestType": "MasterDbUpdateRequest", "masterDbUpdateAllowedBeforeApproval": false, "rollbackRequired": true},
      "notes": "고객 선호도와 A/S 안정성이 중요하다."
    },
    {
      "projectId": "PRJ-REAL-APT-0001",
      "itemId": "BATH-FIX-BASIN-001",
      "itemName": "세면기",
      "category": "BathroomFixture",
      "subcategory": "basin",
      "brandName": "NEEDS_RESEARCH",
      "brandCandidates": ["대림바스", "이누스", "계림", "아메리칸스탠다드", "TOTO"],
      "modelName": "NEEDS_RESEARCH",
      "standardSpec": "긴다리/반다리/카운터형 여부 조사",
      "unit": "ea",
      "quantityBasis": "욕실 수량 및 젠다이/하부장 구성 기준",
      "officialPrice": "NEEDS_RESEARCH",
      "marketPrice": "NEEDS_RESEARCH",
      "dealerPrice": "NEEDS_RESEARCH",
      "supplierPrice": "NEEDS_RESEARCH",
      "internalPrice": "NEEDS_RESEARCH",
      "laborCost": "NEEDS_RESEARCH",
      "accessoryCost": "NEEDS_RESEARCH",
      "installationDifficulty": "UNKNOWN",
      "warrantyPeriod": "NEEDS_RESEARCH",
      "asPolicy": "NEEDS_RESEARCH",
      "commonDefectRisk": ["배수 누수", "수평 불량", "도기 파손", "수전 호환성 문제"],
      "minimumOrderUnit": "NEEDS_RESEARCH",
      "leadTimeDays": "NEEDS_RESEARCH",
      "paymentCondition": "NEEDS_RESEARCH",
      "preferredSupplier": "NEEDS_RESEARCH",
      "alternativeItems": ["카운터 세면기", "반다리 세면기", "하부장 일체형 세면대"],
      "sourceCandidates": [
        {"sourceType": "dealer", "sourceName": "도기 브랜드 대리점", "dataToCollect": ["dealerPrice", "supplierPrice", "compatibleFaucet", "leadTimeDays"]},
        {"sourceType": "internal", "sourceName": "시공팀 설치 기록", "dataToCollect": ["laborCost", "accessoryCost", "defectHistory"]}
      ],
      "sourceType": "NEEDS_RESEARCH",
      "sourceName": "NEEDS_RESEARCH",
      "sourceDate": "NEEDS_RESEARCH",
      "confidenceLevel": "UNKNOWN",
      "updateCycle": "monthly_until_verified",
      "approvalStatus": "NEEDS_RESEARCH",
      "approvalFlow": {"nextStep": "CREATE_MASTER_DB_UPDATE_REQUEST", "approvalRequestType": "MasterDbUpdateRequest", "masterDbUpdateAllowedBeforeApproval": false, "rollbackRequired": true},
      "notes": "세면기 형태에 따라 욕실장/젠다이/수전 구성이 달라진다."
    },
    {
      "projectId": "PRJ-REAL-APT-0001",
      "itemId": "BATH-FIX-FAUCET-001",
      "itemName": "수전",
      "category": "BathroomFixture",
      "subcategory": "basin_faucet",
      "brandName": "NEEDS_RESEARCH",
      "brandCandidates": ["대림바스", "이누스", "계림", "아메리칸스탠다드", "Grohe", "Hansgrohe"],
      "modelName": "NEEDS_RESEARCH",
      "standardSpec": "세면 수전, 원홀/투홀 여부 조사",
      "unit": "ea",
      "quantityBasis": "세면기 수량 기준",
      "officialPrice": "NEEDS_RESEARCH",
      "marketPrice": "NEEDS_RESEARCH",
      "dealerPrice": "NEEDS_RESEARCH",
      "supplierPrice": "NEEDS_RESEARCH",
      "internalPrice": "NEEDS_RESEARCH",
      "laborCost": "NEEDS_RESEARCH",
      "accessoryCost": "NEEDS_RESEARCH",
      "installationDifficulty": "UNKNOWN",
      "warrantyPeriod": "NEEDS_RESEARCH",
      "asPolicy": "NEEDS_RESEARCH",
      "commonDefectRisk": ["누수", "도금 변색", "카트리지 불량", "수압 불만"],
      "minimumOrderUnit": "NEEDS_RESEARCH",
      "leadTimeDays": "NEEDS_RESEARCH",
      "paymentCondition": "NEEDS_RESEARCH",
      "preferredSupplier": "NEEDS_RESEARCH",
      "alternativeItems": ["국산 수전", "수입 수전", "고급 수전"],
      "sourceCandidates": [
        {"sourceType": "dealer", "sourceName": "수전 브랜드 대리점", "dataToCollect": ["dealerPrice", "supplierPrice", "warrantyPeriod", "asPolicy"]},
        {"sourceType": "market", "sourceName": "온라인 욕실 자재몰", "dataToCollect": ["marketPrice", "modelName", "stockStatus"]}
      ],
      "sourceType": "NEEDS_RESEARCH",
      "sourceName": "NEEDS_RESEARCH",
      "sourceDate": "NEEDS_RESEARCH",
      "confidenceLevel": "UNKNOWN",
      "updateCycle": "monthly_until_verified",
      "approvalStatus": "NEEDS_RESEARCH",
      "approvalFlow": {"nextStep": "CREATE_MASTER_DB_UPDATE_REQUEST", "approvalRequestType": "MasterDbUpdateRequest", "masterDbUpdateAllowedBeforeApproval": false, "rollbackRequired": true},
      "notes": "Grohe/Hansgrohe는 고객 선호도와 마진을 별도 비교한다."
    },
    {
      "projectId": "PRJ-REAL-APT-0001",
      "itemId": "BATH-FIX-SHOWER-FAUCET-001",
      "itemName": "샤워수전",
      "category": "BathroomFixture",
      "subcategory": "shower_faucet",
      "brandName": "NEEDS_RESEARCH",
      "brandCandidates": ["대림바스", "이누스", "계림", "아메리칸스탠다드", "Grohe", "Hansgrohe"],
      "modelName": "NEEDS_RESEARCH",
      "standardSpec": "일반 샤워수전/매립형 여부 조사",
      "unit": "ea",
      "quantityBasis": "샤워 구역 수량 기준",
      "officialPrice": "NEEDS_RESEARCH",
      "marketPrice": "NEEDS_RESEARCH",
      "dealerPrice": "NEEDS_RESEARCH",
      "supplierPrice": "NEEDS_RESEARCH",
      "internalPrice": "NEEDS_RESEARCH",
      "laborCost": "NEEDS_RESEARCH",
      "accessoryCost": "NEEDS_RESEARCH",
      "installationDifficulty": "UNKNOWN",
      "warrantyPeriod": "NEEDS_RESEARCH",
      "asPolicy": "NEEDS_RESEARCH",
      "commonDefectRisk": ["누수", "수압 불량", "매립부 하자", "온도 조절 불량"],
      "minimumOrderUnit": "NEEDS_RESEARCH",
      "leadTimeDays": "NEEDS_RESEARCH",
      "paymentCondition": "NEEDS_RESEARCH",
      "preferredSupplier": "NEEDS_RESEARCH",
      "alternativeItems": ["해바라기 샤워기", "매립 샤워수전", "일반 샤워수전"],
      "sourceCandidates": [
        {"sourceType": "dealer", "sourceName": "수전 브랜드 대리점", "dataToCollect": ["dealerPrice", "supplierPrice", "leadTimeDays", "asPolicy"]},
        {"sourceType": "internal", "sourceName": "설비팀 설치 기록", "dataToCollect": ["laborCost", "installationDifficulty", "defectHistory"]}
      ],
      "sourceType": "NEEDS_RESEARCH",
      "sourceName": "NEEDS_RESEARCH",
      "sourceDate": "NEEDS_RESEARCH",
      "confidenceLevel": "UNKNOWN",
      "updateCycle": "monthly_until_verified",
      "approvalStatus": "NEEDS_RESEARCH",
      "approvalFlow": {"nextStep": "CREATE_MASTER_DB_UPDATE_REQUEST", "approvalRequestType": "MasterDbUpdateRequest", "masterDbUpdateAllowedBeforeApproval": false, "rollbackRequired": true},
      "notes": "매립형은 배관 수정과 방수 리스크가 커서 별도 승인 필요."
    },
    {
      "projectId": "PRJ-REAL-APT-0001",
      "itemId": "BATH-FIX-RAIN-SHOWER-001",
      "itemName": "해바라기 샤워기",
      "category": "BathroomFixture",
      "subcategory": "rain_shower",
      "brandName": "NEEDS_RESEARCH",
      "brandCandidates": ["대림바스", "이누스", "아메리칸스탠다드", "Grohe", "Hansgrohe"],
      "modelName": "NEEDS_RESEARCH",
      "standardSpec": "노출형/매립형 해바라기 샤워기 여부 조사",
      "unit": "ea",
      "quantityBasis": "욕실 선택 옵션 기준",
      "officialPrice": "NEEDS_RESEARCH",
      "marketPrice": "NEEDS_RESEARCH",
      "dealerPrice": "NEEDS_RESEARCH",
      "supplierPrice": "NEEDS_RESEARCH",
      "internalPrice": "NEEDS_RESEARCH",
      "laborCost": "NEEDS_RESEARCH",
      "accessoryCost": "NEEDS_RESEARCH",
      "installationDifficulty": "UNKNOWN",
      "warrantyPeriod": "NEEDS_RESEARCH",
      "asPolicy": "NEEDS_RESEARCH",
      "commonDefectRisk": ["수압 불만", "누수", "설치 높이 불만", "부속 교체 어려움"],
      "minimumOrderUnit": "NEEDS_RESEARCH",
      "leadTimeDays": "NEEDS_RESEARCH",
      "paymentCondition": "NEEDS_RESEARCH",
      "preferredSupplier": "NEEDS_RESEARCH",
      "alternativeItems": ["일반 샤워수전", "수입 해바라기 샤워기"],
      "sourceCandidates": [
        {"sourceType": "dealer", "sourceName": "수입/국산 수전 대리점", "dataToCollect": ["dealerPrice", "supplierPrice", "stockStatus", "warrantyPeriod"]},
        {"sourceType": "internal", "sourceName": "고객 선호/클레임 기록", "dataToCollect": ["customerPreference", "claimHistory"]}
      ],
      "sourceType": "NEEDS_RESEARCH",
      "sourceName": "NEEDS_RESEARCH",